{
  "schema_version": 2,
  "artifact_type": "annotation_view",
  "relative_path": "public_data/coco/views/coco80/max-60",
  "support": "historical",
  "origin": {
    "commit": "0f5b505866525cf0dc9bf946a81c6acca280ebaf",
    "manifest_path": "manifests/public_data_provenance/coco/views/coco80/max-60.json",
    "manifest_sha256": "bdcc54cfbe23d16798ae9c505cd28e5acf207a77efabe1d6bcd9d1351a85bc82"
  },
  "checksums": {
    "scope": "jsonl_training_samples_only",
    "algorithm": "sha256",
    "aggregate_sha256": "3c1cbc36f7c359003ff0c8f47dadfbf9e54555ad9a7cb1cc20a87a8240e267a7",
    "aggregate_source": "sorted path sha256 size_bytes records lines",
    "files": [
      {
        "path": "public_data/coco/views/coco80/max-60/train.jsonl",
        "sha256": "fac29a5e6145b8e384f0e5e78b4dc98daf62a13daa31f586fa82a06f7581efa3",
        "size_bytes": 150032103,
        "records": 117247
      },
      {
        "path": "public_data/coco/views/coco80/max-60/val.jsonl",
        "sha256": "907c48c206f5bf0ed05115484f53765c82eb385003d553afbc16d8b3ce1b093c",
        "size_bytes": 6369821,
        "records": 4951
      }
    ]
  },
  "recovery": {
    "mode": "historical_only",
    "reason": "No retained configuration consumes this version and no independent recovery replica was verified. Checksum/provenance is historical, not a promise of an executable producer. Raw-generation details remain at origin.commit:origin.manifest_path."
  },
  "metadata": {
    "view_metadata": {
      "path": "public_data/coco/views/coco80/max-60/meta.json",
      "sha256": "4485378224b97103e865b1e6ab388a4c37e64234422c08ebfb894738e80ec6af",
      "size_bytes": 1015
    },
    "source_comparison": {
      "path": "public_data/coco/views/coco80/max-60/source_comparison.json",
      "sha256": "bf7dafb4511fe61d41f0dc96e0a5e4df2934b1558c230e07f9f485fff3c3995e",
      "size_bytes": 2535
    }
  },
  "notes": "Not a supported current recovery command. Existing external materializations and old identities were not changed."
}
