{
  "schema_version": 2,
  "artifact_type": "processed_directory",
  "relative_path": "public_data/coco/rescale_32_1024_bbox_max60",
  "support": "historical",
  "origin": {
    "commit": "0f5b505866525cf0dc9bf946a81c6acca280ebaf",
    "manifest_path": "manifests/public_data_provenance/coco/rescale_32_1024_bbox_max60.json",
    "manifest_sha256": "aa12be10a5d3c6a3f974f8ebf5c6906c55e9d4ea0b62fd18d3b6fb3be6362eff"
  },
  "checksums": {
    "scope": "jsonl_training_samples_only",
    "algorithm": "sha256",
    "aggregate_sha256": "b8ca3c5805857c6d9a83e14709820aa1d554a6e0bf6145c3c81894115e27e5ff",
    "aggregate_source": "sorted path sha256 size_bytes records lines",
    "files": [
      {
        "path": "public_data/coco/rescale_32_1024_bbox_max60/train.coord.jsonl",
        "sha256": "649fb8c1bf28da65762700ec9b29b9d3419da04d4c2aa330c4ee5085d2b90a6b",
        "size_bytes": 169492296,
        "records": 117247
      },
      {
        "path": "public_data/coco/rescale_32_1024_bbox_max60/train.jsonl",
        "sha256": "13dcdf2053e76fe1ebf4848d8fda0afd8946e7b98b6309c6943d7ac8e50b52ad",
        "size_bytes": 129019910,
        "records": 117247
      },
      {
        "path": "public_data/coco/rescale_32_1024_bbox_max60/train.norm.jsonl",
        "sha256": "1ac5a14eceacd409b44e5d3e8dff3629c6f45d294599e2a342b80b901d9fa103",
        "size_bytes": 128756808,
        "records": 117247
      },
      {
        "path": "public_data/coco/rescale_32_1024_bbox_max60/val.coord.jsonl",
        "sha256": "18a3cad3b7ad847ecf39949fe751d963008dbb7707f796c742c3fa23ae3c8e8b",
        "size_bytes": 7201583,
        "records": 4951
      },
      {
        "path": "public_data/coco/rescale_32_1024_bbox_max60/val.jsonl",
        "sha256": "19486e72864268e7488cc39401c76d2b880f7f6f8701038222edcf7e3e01814e",
        "size_bytes": 5471981,
        "records": 4951
      },
      {
        "path": "public_data/coco/rescale_32_1024_bbox_max60/val.norm.jsonl",
        "sha256": "03cfadf43b2c486ba9daac2e15309e4863614a48204f33996e441bb56e023d4e",
        "size_bytes": 5460479,
        "records": 4951
      }
    ]
  },
  "recovery": {
    "mode": "historical_only",
    "reason": "No retained configuration consumes this version and no independent recovery replica was verified. Checksum/provenance is historical, not a promise of an executable producer. Raw-generation details remain at origin.commit:origin.manifest_path."
  },
  "notes": "Not a supported current recovery command. Existing external materializations and old identities were not changed."
}
